{"id":"lb:transition:replace-0001","schemaVersion":"0.1.0","objectType":"transition","transitionType":"replace","targetId":"lb:obj:example-0001","replacementId":"lb:obj:example-0002","issuedAt":"2026-07-20T01:40:00Z","reason":"Corrected evidence and wording.","provenance":{"sources":[{"protocol":"lingonberry","sourceId":"transition:draft:replace-0001","authorId":"alice","observedAt":"2026-07-20T01:40:00Z"}]},"rawRef":{"protocol":"lingonberry","sourceId":"transition:draft:replace-0001"}}
