{"id":"lb:transition:withdraw-0001","schemaVersion":"0.1.0","objectType":"transition","transitionType":"withdraw","targetId":"lb:obj:example-0001","issuedAt":"2026-07-20T01:41:00Z","reason":"Source requested withdrawal.","provenance":{"sources":[{"protocol":"lingonberry","sourceId":"transition:draft:withdraw-0001","authorId":"alice","observedAt":"2026-07-20T01:41:00Z"}]},"rawRef":{"protocol":"lingonberry","sourceId":"transition:draft:withdraw-0001"}}
